{
  "schema_version": "1.0.0",
  "generated_at": "2026-04-13T22:12:12Z",
  "sources": {
    "bea_nipa_table_1_14": {
      "vintage": "2026-04-13",
      "url": "https://apps.bea.gov/api/data?UserID=C2153B52-B7CE-41F1-A0AD-C88006EE4B6D&method=GetData&datasetname=NIPA&TableName=T11400&Frequency=Q&Year=X&ResultFormat=JSON"
    },
    "fed_z1": {
      "vintage": "2026-03-19",
      "release_quarter": "2026Q1",
      "url": "https://www.federalreserve.gov/releases/z1/20260319/z1_csv_files.zip"
    }
  },
  "frequency": "quarterly",
  "periods": [
    "1947Q4",
    "1948Q4",
    "1949Q4",
    "1950Q4",
    "1951Q4",
    "1952Q1",
    "1952Q2",
    "1952Q3",
    "1952Q4",
    "1953Q1",
    "1953Q2",
    "1953Q3",
    "1953Q4",
    "1954Q1",
    "1954Q2",
    "1954Q3",
    "1954Q4",
    "1955Q1",
    "1955Q2",
    "1955Q3",
    "1955Q4",
    "1956Q1",
    "1956Q2",
    "1956Q3",
    "1956Q4",
    "1957Q1",
    "1957Q2",
    "1957Q3",
    "1957Q4",
    "1958Q1",
    "1958Q2",
    "1958Q3",
    "1958Q4",
    "1959Q1",
    "1959Q2",
    "1959Q3",
    "1959Q4",
    "1960Q1",
    "1960Q2",
    "1960Q3",
    "1960Q4",
    "1961Q1",
    "1961Q2",
    "1961Q3",
    "1961Q4",
    "1962Q1",
    "1962Q2",
    "1962Q3",
    "1962Q4",
    "1963Q1",
    "1963Q2",
    "1963Q3",
    "1963Q4",
    "1964Q1",
    "1964Q2",
    "1964Q3",
    "1964Q4",
    "1965Q1",
    "1965Q2",
    "1965Q3",
    "1965Q4",
    "1966Q1",
    "1966Q2",
    "1966Q3",
    "1966Q4",
    "1967Q1",
    "1967Q2",
    "1967Q3",
    "1967Q4",
    "1968Q1",
    "1968Q2",
    "1968Q3",
    "1968Q4",
    "1969Q1",
    "1969Q2",
    "1969Q3",
    "1969Q4",
    "1970Q1",
    "1970Q2",
    "1970Q3",
    "1970Q4",
    "1971Q1",
    "1971Q2",
    "1971Q3",
    "1971Q4",
    "1972Q1",
    "1972Q2",
    "1972Q3",
    "1972Q4",
    "1973Q1",
    "1973Q2",
    "1973Q3",
    "1973Q4",
    "1974Q1",
    "1974Q2",
    "1974Q3",
    "1974Q4",
    "1975Q1",
    "1975Q2",
    "1975Q3",
    "1975Q4",
    "1976Q1",
    "1976Q2",
    "1976Q3",
    "1976Q4",
    "1977Q1",
    "1977Q2",
    "1977Q3",
    "1977Q4",
    "1978Q1",
    "1978Q2",
    "1978Q3",
    "1978Q4",
    "1979Q1",
    "1979Q2",
    "1979Q3",
    "1979Q4",
    "1980Q1",
    "1980Q2",
    "1980Q3",
    "1980Q4",
    "1981Q1",
    "1981Q2",
    "1981Q3",
    "1981Q4",
    "1982Q1",
    "1982Q2",
    "1982Q3",
    "1982Q4",
    "1983Q1",
    "1983Q2",
    "1983Q3",
    "1983Q4",
    "1984Q1",
    "1984Q2",
    "1984Q3",
    "1984Q4",
    "1985Q1",
    "1985Q2",
    "1985Q3",
    "1985Q4",
    "1986Q1",
    "1986Q2",
    "1986Q3",
    "1986Q4",
    "1987Q1",
    "1987Q2",
    "1987Q3",
    "1987Q4",
    "1988Q1",
    "1988Q2",
    "1988Q3",
    "1988Q4",
    "1989Q1",
    "1989Q2",
    "1989Q3",
    "1989Q4",
    "1990Q1",
    "1990Q2",
    "1990Q3",
    "1990Q4",
    "1991Q1",
    "1991Q2",
    "1991Q3",
    "1991Q4",
    "1992Q1",
    "1992Q2",
    "1992Q3",
    "1992Q4",
    "1993Q1",
    "1993Q2",
    "1993Q3",
    "1993Q4",
    "1994Q1",
    "1994Q2",
    "1994Q3",
    "1994Q4",
    "1995Q1",
    "1995Q2",
    "1995Q3",
    "1995Q4",
    "1996Q1",
    "1996Q2",
    "1996Q3",
    "1996Q4",
    "1997Q1",
    "1997Q2",
    "1997Q3",
    "1997Q4",
    "1998Q1",
    "1998Q2",
    "1998Q3",
    "1998Q4",
    "1999Q1",
    "1999Q2",
    "1999Q3",
    "1999Q4",
    "2000Q1",
    "2000Q2",
    "2000Q3",
    "2000Q4",
    "2001Q1",
    "2001Q2",
    "2001Q3",
    "2001Q4",
    "2002Q1",
    "2002Q2",
    "2002Q3",
    "2002Q4",
    "2003Q1",
    "2003Q2",
    "2003Q3",
    "2003Q4",
    "2004Q1",
    "2004Q2",
    "2004Q3",
    "2004Q4",
    "2005Q1",
    "2005Q2",
    "2005Q3",
    "2005Q4",
    "2006Q1",
    "2006Q2",
    "2006Q3",
    "2006Q4",
    "2007Q1",
    "2007Q2",
    "2007Q3",
    "2007Q4",
    "2008Q1",
    "2008Q2",
    "2008Q3",
    "2008Q4",
    "2009Q1",
    "2009Q2",
    "2009Q3",
    "2009Q4",
    "2010Q1",
    "2010Q2",
    "2010Q3",
    "2010Q4",
    "2011Q1",
    "2011Q2",
    "2011Q3",
    "2011Q4",
    "2012Q1",
    "2012Q2",
    "2012Q3",
    "2012Q4",
    "2013Q1",
    "2013Q2",
    "2013Q3",
    "2013Q4",
    "2014Q1",
    "2014Q2",
    "2014Q3",
    "2014Q4",
    "2015Q1",
    "2015Q2",
    "2015Q3",
    "2015Q4",
    "2016Q1",
    "2016Q2",
    "2016Q3",
    "2016Q4",
    "2017Q1",
    "2017Q2",
    "2017Q3",
    "2017Q4",
    "2018Q1",
    "2018Q2",
    "2018Q3",
    "2018Q4",
    "2019Q1",
    "2019Q2",
    "2019Q3",
    "2019Q4",
    "2020Q1",
    "2020Q2",
    "2020Q3",
    "2020Q4",
    "2021Q1",
    "2021Q2",
    "2021Q3",
    "2021Q4",
    "2022Q1",
    "2022Q2",
    "2022Q3",
    "2022Q4",
    "2023Q1",
    "2023Q2",
    "2023Q3",
    "2023Q4",
    "2024Q1",
    "2024Q2",
    "2024Q3",
    "2024Q4",
    "2025Q1",
    "2025Q2",
    "2025Q3",
    "2025Q4"
  ],
  "series": {
    "gva": {
      "label": "Corporate gross value added",
      "description": "Corporate gross value added.",
      "unit": "level",
      "values": [
        134417.0,
        149954.0,
        139393.0,
        176791.0,
        189972.0,
        191255.0,
        190354.0,
        193134.0,
        205365.0,
        209942.0,
        212171.0,
        211630.0,
        202993.0,
        203265.0,
        204066.0,
        206289.0,
        213841.0,
        223759.0,
        230857.0,
        235619.0,
        241970.0,
        243817.0,
        248071.0,
        250628.0,
        257696.0,
        262357.0,
        262481.0,
        263538.0,
        258268.0,
        249796.0,
        249456.0,
        258235.0,
        269836.0,
        279399.0,
        291226.0,
        287681.0,
        291479.0,
        302111.0,
        300336.0,
        299944.0,
        297129.0,
        296314.0,
        304677.0,
        311809.0,
        322118.0,
        327969.0,
        333549.0,
        338643.0,
        343640.0,
        347425.0,
        354918.0,
        360599.0,
        366509.0,
        375561.0,
        382406.0,
        390321.0,
        395642.0,
        410158.0,
        418114.0,
        426397.0,
        440441.0,
        453023.0,
        461584.0,
        468749.0,
        477004.0,
        479934.0,
        484265.0,
        493785.0,
        506703.0,
        521176.0,
        536540.0,
        548510.0,
        562217.0,
        576663.0,
        586857.0,
        596500.0,
        602589.0,
        602415.0,
        611165.0,
        618424.0,
        616504.0,
        642716.0,
        654543.0,
        666049.0,
        680372.0,
        708004.0,
        722134.0,
        737739.0,
        763729.0,
        795210.0,
        809422.0,
        826644.0,
        849558.0,
        861496.0,
        882651.0,
        901700.0,
        912468.0,
        918738.0,
        943759.0,
        985628.0,
        1014056.0,
        1058724.0,
        1074013.0,
        1097006.0,
        1119490.0,
        1160598.0,
        1216819.0,
        1262086.0,
        1290566.0,
        1320931.0,
        1399564.0,
        1428913.0,
        1478153.0,
        1514193.0,
        1546405.0,
        1580464.0,
        1616360.0,
        1653667.0,
        1655646.0,
        1705002.0,
        1795212.0,
        1867387.0,
        1911750.0,
        1974083.0,
        1987302.0,
        1985469.0,
        2017134.0,
        2035266.0,
        2036388.0,
        2075667.0,
        2140679.0,
        2200284.0,
        2273194.0,
        2366642.0,
        2417036.0,
        2454330.0,
        2501106.0,
        2542522.0,
        2580231.0,
        2632377.0,
        2650847.0,
        2681852.0,
        2687666.0,
        2707765.0,
        2749796.0,
        2796102.0,
        2865263.0,
        2931582.0,
        2987579.0,
        3038249.0,
        3111047.0,
        3170038.0,
        3250801.0,
        3273763.0,
        3303253.0,
        3339628.0,
        3363926.0,
        3417006.0,
        3479030.0,
        3488724.0,
        3484564.0,
        3510360.0,
        3540540.0,
        3570536.0,
        3597336.0,
        3677471.0,
        3724068.0,
        3745789.0,
        3822117.0,
        3799825.0,
        3893006.0,
        3933105.0,
        4049516.0,
        4081895.0,
        4177064.0,
        4250447.0,
        4330914.0,
        4372364.0,
        4429094.0,
        4524400.0,
        4571054.0,
        4654706.0,
        4740154.0,
        4806299.0,
        4879652.0,
        4992056.0,
        5077767.0,
        5200817.0,
        5301962.0,
        5350030.0,
        5431734.0,
        5530324.0,
        5585698.0,
        5699619.0,
        5749118.0,
        5816420.0,
        5943085.0,
        6143318.0,
        6186685.0,
        6272744.0,
        6262014.0,
        6250095.0,
        6240160.0,
        6178241.0,
        6141874.0,
        6209189.0,
        6281774.0,
        6310693.0,
        6392505.0,
        6375060.0,
        6459307.0,
        6581487.0,
        6683938.0,
        6757376.0,
        6898503.0,
        7050983.0,
        7133171.0,
        7273771.0,
        7399047.0,
        7528114.0,
        7740799.0,
        7898544.0,
        7972479.0,
        8098623.0,
        8147617.0,
        8172049.0,
        8250053.0,
        8180667.0,
        8194264.0,
        8193000.0,
        8184288.0,
        8185746.0,
        7872118.0,
        7718811.0,
        7762757.0,
        7815593.0,
        7972185.0,
        8002389.0,
        8126606.0,
        8376065.0,
        8442908.0,
        8421071.0,
        8581177.0,
        8677911.0,
        8811936.0,
        9063187.0,
        9155200.0,
        9150165.0,
        9327426.0,
        9347675.0,
        9411064.0,
        9454843.0,
        9614183.0,
        9709323.0,
        9977314.0,
        10187356.0,
        10312048.0,
        10390668.0,
        10489676.0,
        10525371.0,
        10552339.0,
        10597844.0,
        10612050.0,
        10710222.0,
        10817421.0,
        10935797.0,
        11054217.0,
        11160696.0,
        11380104.0,
        11563099.0,
        11730328.0,